product_name,product_Short description,product_Description,Product_Tax status,In_stock?,product_Stock,product_Weight (g),product_Length (cm),product_Width (cm),product_Height (cm),"product_Sale price,price,rate,value,Rupees,rs,₹",product_Regular price ,product_Category,product_variants,product_colors,product_Attribute 1 name,product_color,Attribute 1 visible,product_Attribute 1 global,product_Attribute 1 default,product_link,product_discount
Camo Dino Adventure Bag - Blue,,Blue,taxable,1,100,850,13,28,36,1770,2670,School Bags,,"{""color"":{""name"":""color"",""type"":""color"",""terms"":{""Blue"":{""name"":""Blue"",""color"":""#0000FF"",""image"":"""",""show_tooltip"":"""",""tooltip_text"":"""",""tooltip_image"":"""",""image_size"":""""}}}}",color,Blue,,1,,https://grabaggs.com/product/camodino-adventure-bag/,33%
Camo Dino Adventure Bag - Sea Green,,Sea Green,taxable,1,100,850,13,28,36,1770,2670,School Bags,,,color,Sea Green,,1,,https://grabaggs.com/product/camodino-adventure-bag/,33%
Camo Dino Adventure Bag - Grey,,Grey,taxable,1,100,850,13,28,36,1770,2670,School Bags,,"{""color"":{""name"":""color"",""type"":""color"",""terms"":{""Grey"":{""name"":""Grey"",""color"":""#808080"",""image"":"""",""show_tooltip"":"""",""tooltip_text"":"""",""tooltip_image"":"""",""image_size"":""""}}}}",color,Grey,,1,,https://grabaggs.com/product/camodino-adventure-bag/,33%
Urban Streak Gear Pack - Grey,,Grey With Yellow,taxable,1,100,850,14,28,36,1770,2670,School Bags,,"{""color"":{""name"":""color"",""type"":""color"",""terms"":{""Grey"":{""name"":""Grey"",""color"":""#808080"",""image"":"""",""show_tooltip"":"""",""tooltip_text"":"""",""tooltip_image"":"""",""image_size"":""""}}}}",color,Grey,,1,,https://grabaggs.com/product/urban-streak-gearpack/,33%
Graffiti Vibe Daypack - Brown,,Brown,taxable,1,100,850,15,28,36,1750,2650,School Bags,,,color,Brown,,1,,https://grabaggs.com/product/graffiti-vibe-daypack/,33%
Fly 2 Space Backpack,"Blast off into learning and adventure with the Fly 2 Space Backpack! Featuring a vibrant graphic of a cool astronaut riding a rocket through the cosmos, this backpack ignites imagination. With ample storage, including a roomy main compartment and handy side pockets, it's perfect for carrying books, gadgets, and snacks. Comfortable padded straps ensure easy and enjoyable transport for school, travel, and beyond","1)Eye-Catching Design: Features a dynamic ""FLY 2 SPACE"" graphic with an astronaut on a rocket, planets, and stars.
\n2)Spacious Storage: Offers a large main compartment and a front zippered pocket for organized belongings.
\n3)Convenient Side Pockets: Includes mesh side pockets ideal for water bottles or quick-access items.
\n4)Comfortable to Carry: Designed with padded shoulder straps and a back panel for comfortable wear.
\n5)Durable Construction: Made from sturdy materials to withstand daily use.
\n6)Inspires Imagination: Perfect for kids who love space, astronauts, and cosmic adventures.",taxable,1,99,850,13,28,36,1199,2199,School Bags,"Black School Bags, School Bags","{""color"":{""name"":""color"",""type"":""color"",""terms"":{""Black"":{""name"":""Black"",""color"":""#000000"",""image"":"""",""show_tooltip"":"""",""tooltip_text"":"""",""tooltip_image"":"""",""image_size"":""""}}}}",color,Black,1,1,Black,https://grabaggs.com/product/fly-2-space-backpack-gbibcb-048-5-at-bk/,45%
Fly 2 Space Backpack - Black,,Black + Yellow Design,taxable,1,99,850,13,28,36,1199,2199,School Bags,,,color,Black,,1,,https://grabaggs.com/product/fly-2-space-backpack-gbibcb-048-5-at-bk/,31%
Moo Mates Cattle Buddy Backpack,"Unleash adventure every school day with theCamoDino Adventure Bag! Featuring playful dinosaur prints on vibrant camo backgrounds, this backpack blends bold style with practical function. Designed with growing kids in mind, it offers ample storage, comfy padding, and cool colors they???ll love to show off. Whether it???s books, lunch, or treasures from the playground, this backpack has space for it all.","Turn every day into a barnyard adventure with the MooMates Cattle Buddy Backpack! Designed to delight and built for comfort, this irresistibly cute cow-themed backpack is perfect for toddlers and preschoolers. With its soft plush features, roomy interior, and adjustable straps, it???s ideal for daycare, outings, or playdates. Lightweight, safe, and full of charm, it's a must-have for little animal lovers.",taxable,1,100,850,19,31,44,1970,2870,School Bags,"Blue School Bags, Grey School Bags, School, School Bags","{""color"":{""name"":""color"",""type"":""color"",""terms"":{""Blue"":{""name"":""Blue"",""color"":""#0000FF"",""image"":"""",""show_tooltip"":"""",""tooltip_text"":"""",""tooltip_image"":"""",""image_size"":""""},""Grey"":{""name"":""Grey"",""color"":""#808080"",""image"":"""",""show_tooltip"":"""",""tooltip_text"":"""",""tooltip_image"":"""",""image_size"":""""}}}}",color,"Blue, Grey",1,1,Grey,https://grabaggs.com/product/moo-mates-cattle-buddy-backpack/,31%
Camo Dino Adventure Bag,"Unleash adventure every school day with theCamoDino Adventure Bag! Featuring playful dinosaur prints on vibrant camo backgrounds, this backpack blends bold style with practical function. Designed with growing kids in mind, it offers ample storage, comfy padding, and cool colors they???ll love to show off. Whether it???s books, lunch, or treasures from the playground, this backpack has space for it all.","1)Playful Dino Theme: Eye-catching dinosaur camo print in 4 fun color combos 2)Spacious &amp; Organized: Multiple zippered compartments for books, lunch, and more 3)Kid-Friendly Comfort: Breathable mesh padding and adjustable shoulder straps 4)Durable Build: Strong fabric and quality zippers built to handle daily adventures 5)Side Mesh Pockets: Perfect for water bottles or easy-grab items 6)Safety Touch: Reflective strips for better visibility on the go 7)Easy-Carry Handle: Grab-and-go top loop for quick lifting",taxable,1,100,850,14,30,40,1770,2670,School Bags,"Blue School Bags, Grey School Bags, School, School Bags, Sea Green Bags","{""color"":{""name"":""color"",""type"":""color"",""terms"":{""Blue"":{""name"":""Blue"",""color"":""#0000FF"",""image"":"""",""show_tooltip"":"""",""tooltip_text"":"""",""tooltip_image"":"""",""image_size"":""""},""Grey"":{""name"":""Grey"",""color"":""#808080"",""image"":"""",""show_tooltip"":"""",""tooltip_text"":"""",""tooltip_image"":"""",""image_size"":""""},""Sea Green"":{""name"":""Sea Green"",""color"":""#2e8b57"",""image"":"""",""show_tooltip"":"""",""tooltip_text"":"""",""tooltip_image"":"""",""image_size"":""""}}}}",color,"Blue, Grey, Sea Green",1,1,Grey,https://grabaggs.com/product/camodino-adventure-bag/,33%
Urban Streak Gear Pack,"The Urban Streak GearPack brings together bold street-style design with practical everyday function. Featuring abstract camo prints in energetic colorways, this backpack is perfect for students and young adventurers alike. With multiple compartments and a sleek, modern aesthetic, it keeps essentials secure and style on point???whether in the classroom or out exploring the city.",,taxable,1,100,850,16,30,42,1770,2670,School Bags,"Black School Bags, Blue School Bags, Grey School Bags, School, School Bags, Sea Green Bags","{""color"":{""name"":""color"",""type"":""color"",""terms"":{""Black"":{""name"":""Black"",""color"":""#000000"",""image"":"""",""show_tooltip"":"""",""tooltip_text"":"""",""tooltip_image"":"""",""image_size"":""""},""Blue"":{""name"":""Blue"",""color"":""#0000FF"",""image"":"""",""show_tooltip"":"""",""tooltip_text"":"""",""tooltip_image"":"""",""image_size"":""""},""Grey"":{""name"":""Grey"",""color"":""#808080"",""image"":"""",""show_tooltip"":"""",""tooltip_text"":"""",""tooltip_image"":"""",""image_size"":""""},""Sea Green"":{""name"":""Sea Green"",""color"":""#2e8b57"",""image"":"""",""show_tooltip"":"""",""tooltip_text"":"""",""tooltip_image"":"""",""image_size"":""""}}}}",color,"Black, Blue, Grey, Sea Green",1,1,Grey,https://grabaggs.com/product/urban-streak-gearpack/,33%
Graffiti Vibe Daypack,"Stand out from the crowd with the Graffiti Vibe Daypack ??? where style meets practicality. Designed for trend-savvy students and explorers, these backpacks feature bold urban prints, graffiti-style artwork, and modern color palettes that turn heads. With spacious compartments and comfy straps, it???s built for everything from school days to weekend outings.","1)Art-Inspired Prints: Graffiti graphics, bold fonts, and animal icons for a fresh urban look
\n2)Roomy Compartments: Large main storage and front pocket to keep items organized
\n3)Front Flap Pocket: Quick-access space for small essentials
\n4)Padded Support: Cushioned shoulder straps and back panel for all-day comfort
\n5)Durable Materials: Built to last through school, travel, and daily wear
\n6)Side Mesh Pockets: Ideal for bottles or snacks
\n7)Unique Color Combos: Choose from earthy tones, vibrant blues, and soft pastels",taxable,1,100,850,16,30,42,1750,2670,School Bags,"Black School Bags, Blue School Bags, Brown School Bags, Cream School Bags, School, School Bags","{""color"":{""name"":""color"",""type"":""color"",""terms"":{""Black"":{""name"":""Black"",""color"":""#000000"",""image"":"""",""show_tooltip"":"""",""tooltip_text"":"""",""tooltip_image"":"""",""image_size"":""""},""Blue"":{""name"":""Blue"",""color"":""#0000FF"",""image"":"""",""show_tooltip"":"""",""tooltip_text"":"""",""tooltip_image"":"""",""image_size"":""""},""Brown"":{""name"":""Brown"",""color"":""#964B00"",""image"":"""",""show_tooltip"":"""",""tooltip_text"":"""",""tooltip_image"":"""",""image_size"":""""},""Cream"":{""name"":""Cream"",""color"":""#FFFDD0"",""image"":"""",""show_tooltip"":"""",""tooltip_text"":"""",""tooltip_image"":"""",""image_size"":""""}}}}",color,"Black, Blue, Brown, Cream",1,1,Black,https://grabaggs.com/product/graffiti-vibe-daypack/,33%
Melody Pop Backpack,"Turn heads with the MelodyPop Backpack ??? a charming blend of soft pastel tones, musical notes, and adorable details. Whether it's for school, casual outings, or weekend fun, this backpack adds a sweet rhythm to your everyday look. With cute character badges, functional compartments, and soft-touch materials, it???s the perfect mix of style and comfort.","1)Pastel Color Options: Available in soft pink, creamy beige, and classic black
\n2)Cute Cartoon Pins: Comes with removable character pins for extra charm
\n3)Multiple Compartments: Easy-to-access front pocket, spacious main storage, and side pouches
\n4)Comfort Fit: Padded shoulder straps and breathable back panel for all-day comfort
\n5)Secure &amp; Stylish: Buckle strap design gives it a modern, mini-satchel vibe
\n6)Perfect for Teens &amp; Tweens: Fashion-forward look with practical use for school and day trips",taxable,1,100,850,20,22,35,1750,2670,School Bags,"Black School Bags, Grey School Bags, Pink School Bags, School, School Bags","{""color"":{""name"":""color"",""type"":""color"",""terms"":{""Black"":{""name"":""Black"",""color"":""#000000"",""image"":"""",""show_tooltip"":"""",""tooltip_text"":"""",""tooltip_image"":"""",""image_size"":""""},""Grey"":{""name"":""Grey"",""color"":""#808080"",""image"":"""",""show_tooltip"":"""",""tooltip_text"":"""",""tooltip_image"":"""",""image_size"":""""},""Pink"":{""name"":""Pink"",""color"":""#c93eab"",""image"":"""",""show_tooltip"":"""",""tooltip_text"":"""",""tooltip_image"":"""",""image_size"":""""}}}}",color,"Black, Grey, Pink",1,1,Black,https://grabaggs.com/product/melodypop-backpack/,33%
Bunny Bloom Bag,"Add a little sparkle to school days with the BunnyBloom Bag ??? the perfect backpack for young dreamers! Featuring pastel tones, cheerful bunny prints, and thoughtful storage solutions, this backpack combines cuteness with comfort. Whether it???s books, stationery, or little treasures, there's a space for everything.","1)Charming Bunny Design ??? Playful and adorable bunny print with ???Happiness??? detail for a cheerful school day.
\n2)Spacious &amp; Organized ??? Multiple compartments including a large main section, front pocket, and side bottle holders.
\n3)Pastel Perfection ??? Available in dreamy pink, soft blue, and creamy beige to match every personality.
\n4)Secure Zippers ??? Smooth, high-quality zippers to keep essentials safe.
\n5)Comfortable Fit ??? Adjustable padded shoulder straps and back panel for everyday comfort.
\n6)Cute &amp; Practical ??? Great for school, daycare, or casual outings",taxable,1,100,850,16,32,46,1799,2699,School Bags,"Blue School Bags, Cream School Bags, Grey School Bags, Pink School Bags, School Bags","{""color"":{""name"":""color"",""type"":""color"",""terms"":{""Blue"":{""name"":""Blue"",""color"":""#0000FF"",""image"":"""",""show_tooltip"":"""",""tooltip_text"":"""",""tooltip_image"":"""",""image_size"":""""},""Cream"":{""name"":""Cream"",""color"":""#FFFDD0"",""image"":"""",""show_tooltip"":"""",""tooltip_text"":"""",""tooltip_image"":"""",""image_size"":""""},""Grey"":{""name"":""Grey"",""color"":""#808080"",""image"":"""",""show_tooltip"":"""",""tooltip_text"":"""",""tooltip_image"":"""",""image_size"":""""},""Pink"":{""name"":""Pink"",""color"":""#c93eab"",""image"":"""",""show_tooltip"":"""",""tooltip_text"":"""",""tooltip_image"":"""",""image_size"":""""}}}}",color,"Blue, Cream, Grey, Pink",1,1,Blue,https://grabaggs.com/product/bunnybloom-bag/,33%
Whimsical Wonder Backpack,"Spark your child's imagination with our Whimsical Wonder Backpack! Designed for comfort and durability, this lightweight bag features a fun, eye-catching design with playful letter and number accents. Multiple compartments keep belongings organized, while padded straps ensure all-day comfort for school, travel, and adventures","1)Fun and engaging design with colorful letter and number details.
\n2)Lightweight and comfortable for young shoulders.
\n3)Multiple compartments for easy organization of books, stationery, and snacks.
\n4)Durable and easy-to-clean material.
\n5)Padded shoulder straps for comfortable carrying.
\n6)Available in a variety of appealing colors",taxable,1,100,850,20,34,46,1699,2599,School Bags,"Black School Bags, Cream School Bags, Grey School Bags, Pink School Bags, School Bags","{""color"":{""name"":""color"",""type"":""color"",""terms"":{""Black"":{""name"":""Black"",""color"":""#000000"",""image"":"""",""show_tooltip"":"""",""tooltip_text"":"""",""tooltip_image"":"""",""image_size"":""""},""Cream"":{""name"":""Cream"",""color"":""#FFFDD0"",""image"":"""",""show_tooltip"":"""",""tooltip_text"":"""",""tooltip_image"":"""",""image_size"":""""},""Grey"":{""name"":""Grey"",""color"":""#808080"",""image"":"""",""show_tooltip"":"""",""tooltip_text"":"""",""tooltip_image"":"""",""image_size"":""""},""Pink"":{""name"":""Pink"",""color"":""#c93eab"",""image"":"""",""show_tooltip"":"""",""tooltip_text"":"""",""tooltip_image"":"""",""image_size"":""""}}}}",color,"Black, Cream, Grey, Pink",1,1,Cream,https://grabaggs.com/product/whimsical-wonder-backpack/,35%
Moo Mates Cattle Buddy Backpack - Blue,,Blue,taxable,1,,,,,46,1970,2870,,,,color,Blue,,1,,https://grabaggs.com/product/moo-mates-cattle-buddy-backpack/,
Unicorn Backpack,"Let your imagination soar with our Unicorn Backpack! This delightful bag features a charming unicorn design and sparkling accents, perfect for adding a touch of magic to everyday adventures. With multiple compartments to keep belongings organized and comfortable padded straps, this backpack is ideal for school, travel, and playdates","1)Whimsical unicorn design with glitter or shimmering details.
\n2)Available in a range of beautiful pastel colors (pink, purple, mint green, blue).
\n3)Multiple compartments for easy organization of books, stationery, and toys.
\n4)Lightweight and comfortable for children to carry.
\n5)Durable material designed to withstand daily use.
\n6)Adjustable, padded shoulder straps for a comfortable fit.",taxable,1,100,850,18,29,42,1770,2670,School Bags,"Blue School Bags, Pink School Bags, Purple School Bags, School Bags, Turquoise School Bags","{""color"":{""name"":""color"",""type"":""color"",""terms"":{""Blue"":{""name"":""Blue"",""color"":""#0000FF"",""image"":"""",""show_tooltip"":"""",""tooltip_text"":"""",""tooltip_image"":"""",""image_size"":""""},""Pink"":{""name"":""Pink"",""color"":""#c93eab"",""image"":"""",""show_tooltip"":"""",""tooltip_text"":"""",""tooltip_image"":"""",""image_size"":""""},""Purple"":{""name"":""Purple"",""color"":""#800080"",""image"":"""",""show_tooltip"":"""",""tooltip_text"":"""",""tooltip_image"":"""",""image_size"":""""},""Turquoise"":{""name"":""Turquoise"",""color"":""#40E0D0"",""image"":"""",""show_tooltip"":"""",""tooltip_text"":"""",""tooltip_image"":"""",""image_size"":""""}}}}",color,"Blue, Pink, Purple, Turquoise",1,1,Turquoise,https://grabaggs.com/product/unicorn-backpack/,33%
Moo Mates Cattle Buddy Backpack - Grey,,Grey,taxable,1,,,,,21,1970,2870,,,,color,Grey,,1,,https://grabaggs.com/product/moo-mates-cattle-buddy-backpack/,
Urban Streak Gear Pack - Blue,,Blue With Yellow,taxable,1,,,,,,1770,2670,,,,color,Blue,,1,,https://grabaggs.com/product/urban-streak-gearpack/,
Checkered Charm Backpack,"Add a touch of classic style to your everyday with our Checkered Charm Backpack. Featuring a charming plaid accent on the front pocket and straps, this backpack offers a delightful blend of fashion and functionality. With multiple compartments to keep your belongings organized and comfortable straps for easy carrying, it's perfect for school, work, or casual outings","1)Stylish plaid detailing on the front pocket and straps.
\n2)Available in a variety of appealing color combinations (cream/pink plaid, purple/lavender plaid, light blue/pink plaid, solid pink/pink plaid).
\n3)Multiple compartments for organized storage of books, devices, and essentials.
\n4)Durable and easy-to-clean material.
\n5)Comfortable, adjustable shoulder straps for a customized fit.
\n6)Sturdy top handle for easy grab-and-go.",taxable,1,100,850,20,34,46,1830,2730,School Bags,"Blue School Bags, Cream School Bags, Pink School Bags, Purple School Bags, School Bags","{""color"":{""name"":""color"",""type"":""color"",""terms"":{""Blue"":{""name"":""Blue"",""color"":""#0000FF"",""image"":"""",""show_tooltip"":"""",""tooltip_text"":"""",""tooltip_image"":"""",""image_size"":""""},""Cream"":{""name"":""Cream"",""color"":""#FFFDD0"",""image"":"""",""show_tooltip"":"""",""tooltip_text"":"""",""tooltip_image"":"""",""image_size"":""""},""Pink"":{""name"":""Pink"",""color"":""#c93eab"",""image"":"""",""show_tooltip"":"""",""tooltip_text"":"""",""tooltip_image"":"""",""image_size"":""""},""Purple"":{""name"":""Purple"",""color"":""#800080"",""image"":"""",""show_tooltip"":"""",""tooltip_text"":"""",""tooltip_image"":"""",""image_size"":""""}}}}",color,"Blue, Cream, Pink, Purple",1,1,Blue,https://grabaggs.com/product/checkered-charm-backpack/,33%
Urban Streak Gear Pack - Black,,Black With Grey,taxable,1,,,,,,1770,2670,,,,color,Black,,1,,https://grabaggs.com/product/urban-streak-gearpack/,
Urban Streak Gear Pack - Sea Green,,Sea Green With Blue,taxable,1,,,,,,1770,2670,,,,color,Sea Green,,1,,https://grabaggs.com/product/urban-streak-gearpack/,
Duo Tone Backpack,"Add a pop of color to your day with our Duo Tone Backpack! Featuring a stylish and eye-catching color-blocked design, this backpack offers a fun and modern aesthetic. With ample storage space and comfortable straps, it's perfect for school, travel, or adding a playful touch to your everyday look","1)Trendy Color Block Design: Features a visually appealing combination of contrasting colors.
\n2)Variety of Color Combos: Available in several unique and stylish color pairings (e.g., beige/pink, pink/coral/lavender, light blue/red/navy).
\n3)Spacious Main Compartment: Offers plenty of room for books, notebooks, and other essentials. ??
\n4)Front Zippered Pocket: Provides additional storage for smaller items. ??
\n5)Side Mesh Pockets: Ideal for carrying water bottles or snacks.
\n6)Comfortable to Carry: Designed with padded shoulder straps and a back panel for comfortable wear. ??
\n7)Durable Material: Made from sturdy materials to withstand daily use.",taxable,1,100,850,12.5,26,35.5,1190,1799,School Bags,"Blue School Bags, Brown School Bags, Pink School Bags, School Bags","{""color"":{""name"":""color"",""type"":""color"",""terms"":{""Blue"":{""name"":""Blue"",""color"":""#0000FF"",""image"":"""",""show_tooltip"":"""",""tooltip_text"":"""",""tooltip_image"":"""",""image_size"":""""},""Brown"":{""name"":""Brown"",""color"":""#964B00"",""image"":"""",""show_tooltip"":"""",""tooltip_text"":"""",""tooltip_image"":"""",""image_size"":""""},""Pink"":{""name"":""Pink"",""color"":""#c93eab"",""image"":"""",""show_tooltip"":"""",""tooltip_text"":"""",""tooltip_image"":"""",""image_size"":""""}}}}",color,"Blue, Brown, Pink",1,1,Blue,https://grabaggs.com/product/duo-tone-backpack/,33%
Graffiti Vibe Daypack - Blue,,Blue,taxable,1,,,,,,1750,2650,,,,color,Blue,,1,,https://grabaggs.com/product/graffiti-vibe-daypack/,
Graffiti Vibe Daypack - Cream,,Cream,taxable,1,,,,,,1750,2650,,,,color,Cream,,1,,https://grabaggs.com/product/graffiti-vibe-daypack/,
Graffiti Vibe Daypack - Black,,Black,taxable,1,,,,,,1750,2650,,,,color,Black,,1,,https://grabaggs.com/product/graffiti-vibe-daypack/,
Tie-Dye Dreams Pack,"Carry your essentials in a cloud of color with our Tie-Dye Dreams Pack. Featuring a beautiful and soft tie-dye effect in dreamy pastel shades, this backpack offers a unique and gentle aesthetic. With ample storage space and comfortable carrying straps, it's perfect for students and anyone who loves a touch of subtle, artistic flair","1)Dreamy Pastel Tie-Dye: Features a soft and visually appealing watercolor-like blend of pastel colors.
\n2)Variety of Gentle Hues: Available in light blue, soft pink, and delicate lavender combinations.
\n3)Spacious Main Compartment: Offers plenty of room for books, notebooks, and larger items.
\n4)Multiple Pockets for Organization: Includes a front zippered pocket and side pockets for keeping belongings tidy. ??
\n5)Comfortable to Carry: Designed with padded shoulder straps and a cushioned back panel. ??
\n6)Durable and Lightweight: Made from sturdy yet light materials for everyday use.
\n7)ncludes Fluffy Pom-Pom: Features a cute, detachable fluffy pom-pom for added charm.",taxable,1,100,850,20,34,46,1770,2699,School Bags,"Blue School Bags, Pink School Bags, Purple School Bags, School Bags","{""color"":{""name"":""color"",""type"":""color"",""terms"":{""Blue"":{""name"":""Blue"",""color"":""#0000FF"",""image"":"""",""show_tooltip"":"""",""tooltip_text"":"""",""tooltip_image"":"""",""image_size"":""""},""Pink"":{""name"":""Pink"",""color"":""#c93eab"",""image"":"""",""show_tooltip"":"""",""tooltip_text"":"""",""tooltip_image"":"""",""image_size"":""""},""Purple"":{""name"":""Purple"",""color"":""#800080"",""image"":"""",""show_tooltip"":"""",""tooltip_text"":"""",""tooltip_image"":"""",""image_size"":""""}}}}",color,"Blue, Pink, Purple",1,1,Blue,https://grabaggs.com/product/tie-dye-dreams-pack/,35%
Melody Pop Backpack - Black,,Black,taxable,1,,,,,,1770,2670,,,,color,Black,,1,,https://grabaggs.com/product/melodypop-backpack/,
Melody Pop Backpack - Grey,,Grey,taxable,1,,,,,,1770,2670,,,,color,Grey,,1,,https://grabaggs.com/product/melodypop-backpack/,
Simply Chic Backpack,"Embrace understated style with our Simply Chic Backpack. Featuring a clean, solid color design, this backpack offers a versatile and modern look. With ample storage space and comfortable carrying features, it's the perfect everyday companion for school, work, or casual outings.","1)Clean and Minimalist Design: Features a stylish solid color aesthetic.
\n2)Versatile Color Options: Available in classic and trendy solid colors (black, pink, light blue).
\n3)Spacious Main Compartment: Offers ample room for books, notebooks, and other essentials
\n4)Multiple Pockets for Organization: Includes a front zippered pocket and side pockets for keeping belongings tidy.
\n5)Comfortable to Carry: Designed with padded shoulder straps and a cushioned back panel.
\n6)Suitable for Various Ages: The simple yet stylish design appeals to a wide range of users.",taxable,1,100,850,20,34,46,1770,2699,School Bags,"Black School Bags, Blue School Bags, Pink School Bags, School Bags","{""color"":{""name"":""color"",""type"":""color"",""terms"":{""Black"":{""name"":""Black"",""color"":""#000000"",""image"":"""",""show_tooltip"":"""",""tooltip_text"":"""",""tooltip_image"":"""",""image_size"":""""},""Blue"":{""name"":""Blue"",""color"":""#0000FF"",""image"":"""",""show_tooltip"":"""",""tooltip_text"":"""",""tooltip_image"":"""",""image_size"":""""},""Pink"":{""name"":""Pink"",""color"":""#c93eab"",""image"":"""",""show_tooltip"":"""",""tooltip_text"":"""",""tooltip_image"":"""",""image_size"":""""}}}}",color,"Black, Blue, Pink",1,1,Black,https://grabaggs.com/product/simply-chic-backpack/,34%
Melody Pop Backpack - Pink,,Pink,taxable,1,,,,,,1770,2670,,,,color,Pink,,1,,https://grabaggs.com/product/melodypop-backpack/,
Bunny Bloom Bag - Blue,,Blue,taxable,1,,,,,,1799,2699,,,,color,Blue,,1,,https://grabaggs.com/product/bunnybloom-bag/,
Bunny Bloom Bag - Pink,,Pink,taxable,1,,,,,,1799,2699,,,,color,Pink,,1,,https://grabaggs.com/product/bunnybloom-bag/,
