product_name,product_Short description,product_Description,Product_Tax status,In_stock?,product_Stock,product_Weight (g),product_Length (cm),product_Width (cm),product_Height (cm),"product_Sale price,price,rate,value,Rupees,rs,₹",product_Regular price ,product_Category,product_variants,product_colors,product_Attribute 1 name,product_color,Attribute 1 visible,product_Attribute 1 global,product_Attribute 1 default,product_link,product_discount
SukiSaku  Little Lion Jungle Theme Kids Backpack,"1. Charming jungle design: Cute lion faces and tropical leaves in playful colors\n2. Bright and happy palette: Dominant yellow with peach-pink zipper accents\n3. Functional design: Main compartment, front zip pocket, and side mesh pouches\n4. Comfortable for kids: Soft shoulder straps and top handle for easy carrying\n5. Durable for everyday use: Lightweight yet sturdy for active young kids","The SukiSaku Little Lion Jungle Kids Backpack is a cheerful and vibrant choice for little explorers. With a sunny yellow background and adorable lion illustrations surrounded by colorful leaves, this backpack captures the spirit of fun and adventure. Ideal for school, daycare, or outings, it keeps essentials close in a kid-friendly design.",taxable,1,100,350,12,25,30,,,Kids Bags,"Kids Bags, Yellow Kids Bags","{""color"":{""name"":""color"",""type"":""color"",""terms"":{""Yellow"":{""name"":""Yellow"",""color"":""#FFFF00"",""image"":"""",""show_tooltip"":"""",""tooltip_text"":"""",""tooltip_image"":"""",""image_size"":""""}}}}",color,Yellow,1,1,Yellow,https://grabaggs.com/product/sukisaku-little-lion-jungle-theme-kids-backpack/,47%
SukiSaku Aqua Safari Adventure Kids Backpack,"1. Unique animal-themed print: Featuring stylized safari animals in black on teal\n2. Bold and modern color scheme: Aqua base with black trim and accents\n3. Kid-friendly compartments: Spacious main pocket, front zip pouch, and side mesh holders\n4. Built for comfort: Soft, adjustable shoulder straps and a sturdy top handle\n5. Durable material: Lightweight yet strong construction for everyday wear and tear","The SukiSaku Aqua Safari Adventure Kids Backpack features a playful animal silhouette design in black on a cool aqua background. With giraffes, crocodiles, snakes, and more in a quirky, artistic style, this backpack is ideal for children who love nature and adventure. It's perfect for daily school use or fun outdoor excursions.",taxable,1,100,350,12,25,30,,,Kids Bags,"Kids Bags, Sky Blue Kids Bags","{""color"":{""name"":""color"",""type"":""color"",""terms"":{""Sky Blue"":{""name"":""Sky Blue"",""color"":""#87CEEB"",""image"":"""",""show_tooltip"":"""",""tooltip_text"":"""",""tooltip_image"":"""",""image_size"":""""}}}}",color,Sky Blue,1,1,Sky Blue,https://grabaggs.com/product/sukisaku-aqua-safari-adventure-kids-backpack/,47%
SukiSaku Magical Unicorn Sparkle Kids Backpack,"1. Shiny and eye-catching design: Metallic gold and glittery pink finishes\n2. Charming unicorn graphics: Surrounded by stars, swirls, and sparkles\n3. Spacious and organized: Multiple compartments including a glitter zip pocket\n4. Durable & fun: Water-resistant finish with comfortable padded straps\n5. Glitter panel & glossy shine: For that extra glam look kids adore","The SukiSaku Magical Unicorn Sparkle Backpack dazzles with its metallic gold base, shimmering pink accents, and an enchanting unicorn design. This backpack is perfect for unicorn-loving kids who want to stand out with a bold, fantasy-inspired look. It blends practicality with magical flair for both school and play.",taxable,1,100,350,12,25,30,,,Kids Bags,"Kids Bags, Purple Kids Bags","{""color"":{""name"":""color"",""type"":""color"",""terms"":{""Purple"":{""name"":""Purple"",""color"":""#800080"",""image"":"""",""show_tooltip"":"""",""tooltip_text"":"""",""tooltip_image"":"""",""image_size"":""""}}}}",color,Purple,1,1,Purple,https://grabaggs.com/product/sukisaku-magical-unicorn-sparkle-kids-backpack/,47%
SukiSaku Rainbow Joy Edition Kids Backpack,"1. Colorful and whimsical pattern: Rainbows, unicorns, hearts, stars, fruits, and clouds\n2. Glossy purple accents: Adds shine and a premium look\n3. Dual side mesh pockets: For bottles or small essentials\n4. Spacious compartments: Front zip pocket and roomy main compartment for school supplies or toys\n5. Comfortable to wear: Soft shoulder straps and top loop handle","The SukiSaku Rainbow Joy Backpack bursts with cheerful, playful energy, featuring a vibrant mix of rainbows, clouds, hearts, suns, stars, and fruity patterns on a bright purple background. It's the perfect bag for kids who love color, happiness, and expressing their joyful personality wherever they go.",taxable,1,100,350,12,25,30,,,Kids Bags,"Kids Bags, Purple Kids Bags","{""color"":{""name"":""color"",""type"":""color"",""terms"":{""Purple"":{""name"":""Purple"",""color"":""#800080"",""image"":"""",""show_tooltip"":"""",""tooltip_text"":"""",""tooltip_image"":"""",""image_size"":""""}}}}",color,Purple,1,1,Purple,https://grabaggs.com/product/sukisaku-rainbow-joy-edition-kids-backpack/,47%
SukiSaku Magical Unicorn Dream Kids Backpack,"1. Enchanting unicorn print: Soft pastel unicorns with wings and stars\n2. Iridescent, glossy accents: Shimmering front and side panels for extra flair\n3. Dual mesh side pockets: Ideal for bottles or small essentials\n4. Comfort-focused design: Padded straps and back panel\n5. Roomy compartments: Perfect for school or play","The SukiSaku Magical Unicorn Dream Backpack is a delightful accessory for young unicorn lovers. Featuring a charming pattern of flying pastel unicorns on a lavender background, it combines playful fantasy with functional design. Holographic rainbow accents on the pockets and sides add a shiny, magical effect that makes it stand out in any crowd",taxable,1,100,350,12,25,30,,,Kids Bags,"Kids Bags, Light Purple Kids Bags","{""color"":{""name"":""color"",""type"":""color"",""terms"":{""Light Purple"":{""name"":""Light Purple"",""color"":""#CBC3E3"",""image"":"""",""show_tooltip"":"""",""tooltip_text"":"""",""tooltip_image"":"""",""image_size"":""""}}}}",color,Light Purple,1,1,Light Purple,https://grabaggs.com/product/sukisaku-magical-unicorn-dream-kids-backpack/,47%
SukiSaku Forest Unicorn Fantasy Kids Backpack,"1. Whimsical forest unicorn print with rainbows, flowers, and magical creatures\n2. Glossy, iridescent accents on the front pocket and side panels\n3. Side mesh pockets for bottles or accessories\n4. Ergonomic padded straps and back panel\n5. Durable and lightweight for daily school or travel use","Let imagination roam free with the SukiSaku Forest Unicorn Fantasy Backpack. Featuring a magical woodland theme with unicorns, rainbows, stars, and forest elements like trees and mushrooms, this backpack is perfect for young adventurers. Its shiny holographic details and pastel pink zippers bring a whimsical touch to a practical and comfortable design.",taxable,1,100,350,12,25,30,,,Kids Bags,"Kids Bags, Sky Blue Kids Bags","{""color"":{""name"":""color"",""type"":""color"",""terms"":{""Sky Blue"":{""name"":""Sky Blue"",""color"":""#87CEEB"",""image"":"""",""show_tooltip"":"""",""tooltip_text"":"""",""tooltip_image"":"""",""image_size"":""""}}}}",color,Sky Blue,1,1,Sky Blue,https://grabaggs.com/product/sukisaku-forest-unicorn-fantasy-kids-backpack/,47%
SukiSaku Triceratops Dino Roar Kids Backpack,"1. 3D Triceratops face on the front pocket adds playful personality\n2. Dinosaur comic-style graphics with words like ""ROAR!"", ""CHOMP!"", and ""BOOM!""\n3. Reinforced top handle and adjustable padded shoulder straps\n4. Side mesh pockets ideal for bottles or quick-access items\n5. Durable zippers and structure for everyday use","Unleash your child's wild side with the SukiSaku Triceratops Dino Roar Backpack. Designed with an eye-catching dinosaur comic-style print, this backpack features a bold 3D triceratops face on the front pocket. The monochrome and orange accents bring a modern dino twist to a fun and functional school or outing essential.",taxable,1,100,500,12,25,30,,,Kids Bags,"Grey Kids Bags, Kids Bags","{""color"":{""name"":""color"",""type"":""color"",""terms"":{""Grey"":{""name"":""Grey"",""color"":""#808080"",""image"":"""",""show_tooltip"":"""",""tooltip_text"":"""",""tooltip_image"":"""",""image_size"":""""}}}}",color,Grey,1,1,Grey,https://grabaggs.com/product/sukisaku-triceratops-dino-roar-kids-backpack/,47%
SukiSaku T-Rex Jungle Adventure Kids Backpack,"1. 3D T-Rex design with a textured face and appliqu? teeth\n2. Colorful dinosaur jungle print with palm trees, volcanos, and more\n3. Mesh side pockets for bottles or snacks\n4. Padded shoulder straps and back panel for comfort\n5. Durable, easy-to-clean material","Bring prehistoric fun to everyday adventures with the SukiSaku T-Rex Jungle Adventure Backpack. This vibrant kids' backpack features a playful 3D T-Rex face on a background full of dinosaurs and volcanoes. Ideal for school or daycare, it combines colorful design with practical functionality.",taxable,1,100,500,12,26,30,,,Kids Bags,"Kids Bags, Olive Green Kids Bags","{""color"":{""name"":""color"",""type"":""color"",""terms"":{""Olive Green"":{""name"":""Olive Green"",""color"":""#2eb089"",""image"":"""",""show_tooltip"":"""",""tooltip_text"":"""",""tooltip_image"":"""",""image_size"":""""}}}}",color,Olive Green,1,1,Olive Green,https://grabaggs.com/product/sukisaku-rocketship-space-explorer-kids-backpack/,47%
SukiSaku Rocketship Space Explorer Kids Backpack,"1. 3D rocket design with fins and ""blast-off"" flames\n2. Space-themed pattern with labeled planets, stars, and astronauts\n3. Mesh side pockets for water bottles or small items\n4. Comfortable padded straps and back panel\n5. Durable and easy-to-clean material","Ignite your child?s imagination with the SukiSaku Rocketship Space Explorer Backpack. Designed like a colorful rocket ready for launch, this playful backpack features a space-themed print with planets, astronauts, and a 3D rocket on the front. Perfect for budding astronauts and young adventurers heading to school or daycare.",taxable,1,100,500,12,26,30,,,Kids Bags,"Blue Kids Bags, Kids Bags","{""color"":{""name"":""color"",""type"":""color"",""terms"":{""Blue"":{""name"":""Blue"",""color"":""#0000FF"",""image"":"""",""show_tooltip"":"""",""tooltip_text"":"""",""tooltip_image"":"""",""image_size"":""""}}}}",color,Blue,1,1,Blue,https://grabaggs.com/product/sukisaku-rocketship-space-explorer-kids-backpack/,47%
SukiSaku Cosmic Planet Blaster Kids Backpack,"1. 3D Planet Design with metallic and velvet textures\n2. Colorful space print with rockets, stars, and planets\n3. Front pocket shaped like Saturn with a rocket accent\n4. Mesh side pockets for drinks or accessories\n5. Adjustable padded straps for all-day comfort\n6. Durable zippers and easy-to-clean material","The SukiSaku Cosmic Planet Blaster Backpack is a colorful and exciting space-themed accessory for kids who love outer space. The standout 3D planet with a bright orange ring and rocket patch makes this bag a real eye-catcher, perfect for school, daycare, or adventures.",taxable,1,100,500,12,26,30,,,Kids Bags,"Black Kids Bags, Kids Bags","{""color"":{""name"":""color"",""type"":""color"",""terms"":{""Black"":{""name"":""Black"",""color"":""#000000"",""image"":"""",""show_tooltip"":"""",""tooltip_text"":"""",""tooltip_image"":"""",""image_size"":""""}}}}",color,Black,1,1,Black,https://grabaggs.com/product/sukisaku-cosmic-planet-blaster-kids-backpack/,47%
SukiSaku Astronaut Adventure Kids Backpack,"1. 3D Astronaut suit design with a reflective, holographic ""helmet"" window\n2. Detailed front panel resembling a spacesuit control system\n3. Colorful cosmic print with planets, rockets, and stars\n4. Spacious main compartment with durable zipper\n5. Padded shoulder straps and back for comfort\n6. Mesh side pockets for water bottles or gear\n7. Rainbow handle strap for easy carry and a fun touch","The SukiSaku Astronaut Adventure Backpack features a stunning 3D astronaut suit design with a large iridescent helmet window, perfect for little explorers who dream of space. This backpack turns school days into interstellar missions with its space-themed print and creative structure.",taxable,1,100,500,12,26,31,,,Kids Bags,"Black Kids Bags, Kids Bags","{""color"":{""name"":""color"",""type"":""color"",""terms"":{""Black"":{""name"":""Black"",""color"":""#000000"",""image"":"""",""show_tooltip"":"""",""tooltip_text"":"""",""tooltip_image"":"""",""image_size"":""""}}}}",color,Black,1,1,Black,https://grabaggs.com/product/sukisaku-astronaut-adventure-kids-backpack/,47%
SukiSaku Construction Theme Kids Backpack - Black,,,taxable,1,,,,,,899,1699,,,,color,Black,,1,,,
SukiSaku Magical Unicorn Wings Kids Backpack,1. Sparkly 3D unicorn horn on top of the backpack\n2. Large iridescent angel wings attached to the front pocket\n3. Removable or foldable shimmering fabric wings for dramatic flair\n4. Playful unicorn and heart-themed pattern across the body\n5. Side mesh pocket for water bottles\n6. Soft padded shoulder straps and back panel for comfort\n7. Durable top handle for easy grab-and-go use\n8. Vibrant purple palette with glittery accents,"Turn everyday adventures into a magical journey with the SukiSaku Magical Unicorn Wings Backpack. This dreamy purple backpack features sparkling fairy wings, a unicorn horn, and shimmering angel wings on the front?perfect for unicorn lovers and fantasy enthusiasts.",taxable,1,100,500,12,26,31,,,Kids Bags,"Kids Bags, Purple Kids Bags","{""color"":{""name"":""color"",""type"":""color"",""terms"":{""Purple"":{""name"":""Purple"",""color"":""#800080"",""image"":"""",""show_tooltip"":"""",""tooltip_text"":"""",""tooltip_image"":"""",""image_size"":""""}}}}",color,Purple,1,1,Purple,https://grabaggs.com/product/sukisaku-magical-unicorn-wings-kids-backpack/,46%
SukiSaku Blue Transport Theme Kids Backpack - Blue,,,taxable,1,,,,,,899,1699,,,,color,Blue,,1,,,
SukiSaku Unicorn Backpack for Kids,1. Eye-catching unicorn design with vibrant colors\n2. Glittery white unicorn front pocket for added flair\n3. Comfortable shoulder straps\n4. Ideal for preschool or early elementary school children\n5. Lightweight and fun ? perfect for carrying small essentials,"This charming backpack is perfect for young unicorn lovers. It features a delightful pink background adorned with various playful unicorn illustrations. The front pocket is uniquely designed in the shape of a glittery white unicorn with a colorful mane, tail, and a striped saddle, adding a touch of magic to everyday school or travel activities",taxable,1,100,500,12,26,31,,,Kids Bags,"Kids Bags, Pink Kids Bags","{""color"":{""name"":""color"",""type"":""color"",""terms"":{""Pink"":{""name"":""Pink"",""color"":""#c93eab"",""image"":"""",""show_tooltip"":"""",""tooltip_text"":"""",""tooltip_image"":"""",""image_size"":""""}}}}",color,Pink,1,1,Pink,https://grabaggs.com/product/sukisaku-unicorn-backpack-for-kids/,46%
SukiSaku Dinosaur Adventure Theme Kids Backpack - Navy Blue,,,taxable,1,,,,,,899,1699,,,,color,Navy Blue,,1,,,
SmartKidz Truck-Themed Backpack for Kids,1. -catching 3D truck design on the front\n2. Colorful vehicle print fabric on the top and sides\n3. Spacious main compartment and front pocket\n4. Side mesh pockets for bottles or accessories\n5. Comfortable padded straps and rainbow top handle\n6. Durable and easy to clean,"Make every day an adventure with this truck-themed backpack designed for little explorers. The front of the backpack features a fun, 3D-style truck face complete with headlights, a grill, and a windshield made of reflective material for added visual effect. The upper section is decorated with colorful vehicle prints, adding even more excitement to the design. Perfect for kids who love trucks and all things that go!",taxable,1,100,500,12,27,35,,,Kids Bags,"Black Kids Bags, Kids Bags","{""color"":{""name"":""color"",""type"":""color"",""terms"":{""Black"":{""name"":""Black"",""color"":""#000000"",""image"":"""",""show_tooltip"":"""",""tooltip_text"":"""",""tooltip_image"":"""",""image_size"":""""}}}}",color,Black,1,1,Black,https://grabaggs.com/product/smartkidz-truck-themed-backpack-for-kids/,46%
SukiSaku Pink Dino Fantasy Theme Kids Backpack - Pink,,,taxable,1,,,,,,899,1699,,,,color,Pink,,1,,,
SukiSaku Glitter Daisy Mini Backpack,1. Unique circular shape with a holographic finish\n2. Glittery daisy with smiling face and closed eyes for a charming touch\n3. Compact and lightweight design\n4. Adjustable straps for a comfortable fit\n5. Ideal for preschoolers or as a statement accessory,"Brighten up any day with this delightful daisy-themed mini backpack! Featuring a round holographic body and a smiling daisy face made of shimmering glitter fabric, this bag brings a cheerful and playful vibe wherever it goes. Perfect for young kids or as a cute fashion accessory, it?s both eye-catching and fun",taxable,1,100,400,8,23,,,,Kids Bags,"Kids Bags, Pink Kids Bags","{""color"":{""name"":""color"",""type"":""color"",""terms"":{""Pink"":{""name"":""Pink"",""color"":""#c93eab"",""image"":"""",""show_tooltip"":"""",""tooltip_text"":"""",""tooltip_image"":"""",""image_size"":""""}}}}",color,Pink,1,1,Pink,https://grabaggs.com/product/sukisaku-glitter-daisy-mini-backpack/,46%
SukiSaku Outer Space Explorer Theme Kids Backpack - Black,,,taxable,1,,,,,,899,1699,,,,color,Black,,1,,,
SukiSaku Ritzy Rainbow & Starry Clouds Backpack,"1. Glitter rainbow design with pastel holographic clouds\n2. Two zipped compartments, including a main double-zip section\n3. Adjustable shoulder straps and a carry handle\n4. Name label included for personalization\n5. Fun and functional for school, outings, or travel\n6. Durable and easy to clean with a wipeable surface","Bring magic to every day with the SukiSaku Ritzy Rainbow & Starry Clouds Backpack. This enchanting backpack showcases a vibrant rainbow design in sparkling shades of pink, purple, and blue. Two holographic cloud patches filled with glittery stars complete the look, making it perfect for kids who love fun, color, and fantasy. With practical compartments and adjustable straps, it?s as functional as it is fabulous.",taxable,1,100,400,10,25,28,,,Kids Bags,"Kids Bags, Pink Kids Bags","{""color"":{""name"":""color"",""type"":""color"",""terms"":{""Pink"":{""name"":""Pink"",""color"":""#c93eab"",""image"":"""",""show_tooltip"":"""",""tooltip_text"":"""",""tooltip_image"":"""",""image_size"":""""}}}}",color,Pink,1,1,Pink,https://grabaggs.com/product/sukisaku-ritzy-rainbow-starry-clouds-backpack/,46%
SukiSaku  Little Lion Jungle Theme Kids Backpack - Yellow,,,taxable,1,,,,,,899,1699,,,,color,Yellow,,1,,,
Kawaii-Q Paragliding Mouse Backpack,"1. Soft plush material, gentle on kids? skin\n2. Fun and friendly mouse design with pilot goggles\n3. Lightweight (160?170g), perfect for toddlers\n4. Zipped main compartment for small items or snacks\n5. Adjustable straps for comfort and proper fit","The Paragliding Mouse backpack by Kawaii-Q is a charming and playful plush bag designed especially for toddlers aged 2?4. Featuring a soft and cuddly mouse with adorable goggles and large ears, it offers both fun and functionality. Ideal for daily use, holidays, or daycare, it?s lightweight and easy to carry for little hands.",taxable,1,100,350,10,24,26,,,Kids Bags,"Blue Kids Bags, Kids Bags","{""color"":{""name"":""color"",""type"":""color"",""terms"":{""Blue"":{""name"":""Blue"",""color"":""#0000FF"",""image"":"""",""show_tooltip"":"""",""tooltip_text"":"""",""tooltip_image"":"""",""image_size"":""""}}}}",color,Blue,1,1,Blue,https://grabaggs.com/product/kawaii-q-paragliding-mouse-backpack/,43%
SukiSaku Aqua Safari Adventure Kids Backpack - Sky Blue,,,taxable,1,,,,,,899,1699,,,,color,Sky Blue,,1,,,
Kawaii-Q Skating Penguin Backpack,"1. Made of soft plush fabric, gentle and safe for kids\n2. Cheerful penguin design with sporty helmet and flipper accents\n3. Lightweight (160?170g), ideal for toddlers\n4. Main zippered compartment for snacks, toys, or essentials\n5. Adjustable shoulder straps for a snug, comfortable fit\n6. Unisex design for children aged 2?4\n7. Great for daily use, travel, or holiday activities","The Skating Penguin backpack by Kawaii-Q is a fun, plush companion perfect for toddlers aged 2?4. With a cute penguin face donning a helmet and flipper-like side accents, this backpack is designed for comfort, charm, and ease of use for little explorers. It?s lightweight, soft, and ideal for daycare, playdates, or outings.",taxable,1,100,350,10,24,26,,,Kids Bags,"Kids Bags, Orange Kids Bags","{""color"":{""name"":""color"",""type"":""color"",""terms"":{""Orange"":{""name"":""Orange"",""color"":""#FFA500"",""image"":"""",""show_tooltip"":"""",""tooltip_text"":"""",""tooltip_image"":"""",""image_size"":""""}}}}",color,Orange,1,1,Orange,https://grabaggs.com/product/kawaii-q-skating-penguin-backpack/,43%
SukiSaku Magical Unicorn Sparkle Kids Backpack - Purple,,,taxable,1,,,,,,899,1699,,,,color,Purple,,1,,,
Kawaii-Q Rock-climbing Monkey Backpack,"1. Ultra-soft plush material for child-friendly comfort\n2. Cute monkey design with helmet detail\n3. Lightweight (160?170g), great for toddlers\n4. One main zippered compartment for easy access\n5. Adjustable straps for comfortable wear\n6. Unisex and age-appropriate (2?4 years)\n7. Great for leisure, preschool, and holiday activities","The Rock-climbing Monkey backpack by Kawaii-Q brings adventurous fun to daily life. Designed for toddlers aged 2?4, this plush backpack features an adorable monkey face with climbing gear details, making it perfect for active little ones. Soft, lightweight, and playful, it?s suitable for daily outings, preschool, or vacation use.",taxable,1,100,350,10,24,26,,,Kids Bags,"Green Kids Bags, Kids Bags","{""color"":{""name"":""color"",""type"":""color"",""terms"":{""Green"":{""name"":""Green"",""color"":""#008000"",""image"":"""",""show_tooltip"":"""",""tooltip_text"":"""",""tooltip_image"":"""",""image_size"":""""}}}}",color,Green,1,1,Green,https://grabaggs.com/product/kawaii-q-rock-climbing-monkey-backpack/,43%
SukiSaku Rainbow Joy Edition Kids Backpack - Purple,,,taxable,1,,,,,,899,1699,,,,color,Purple,,1,,,
Kawaii-Q Tennis Tiger Kids Backpack,"1. Adorable Design ? Features a playful Tennis Tiger character that kids will love.2.  Soft & Safe ? Made from premium plush material, gentle on young skin and perfect for toddlers.\n3.  Perfect for Toddlers ? Designed for children aged 2?4 years, with a unisex style suitable for both boys and girls.\n4. Ultra-Lightweight ? Weighs only 160?170g, making it easy and comfortable for little ones to carry.\n5. Versatile Use ? Ideal for daily outings, preschool, playdates, and holiday trips.\n6. Quality Craftsmanship ? Durable stitching and zippers built to withstand toddler adventures.","The Kawaii-Q Tennis Tiger Plush Backpack is a fun, soft, and lightweight backpack designed especially for toddlers aged 2 to 4 years. Made from high-quality plush material, this adorable unisex backpack features a charming tiger character with a sporty tennis theme. Perfect for daily use, outings, and holiday adventures, it combines functionality with playful design, making it a favorite companion for little explorers.",taxable,1,100,350,10,24,26,,,Kids Bags,"Dark Green Kids Bags, Kids Bags","{""color"":{""name"":""color"",""type"":""color"",""terms"":{""Dark Green"":{""name"":""Dark Green"",""color"":""#006400"",""image"":"""",""show_tooltip"":"""",""tooltip_text"":"""",""tooltip_image"":"""",""image_size"":""""}}}}",color,Dark Green,1,1,Dark Green,https://grabaggs.com/product/kawaii-q-tennis-tiger-kids-backpack/,43%
SukiSaku Magical Unicorn Dream Kids Backpack - Light Purple,,,taxable,1,,,,,,899,1699,,,,color,Light Purple,,1,,,
Kawaii-Q Football Bear Plush Backpack,"1. Charming Football Bear Design ? A lovable bear character wearing a football cap adds fun to every outing.\n2.  Exquisite Embroidery ? High-quality embroidery details for a premium, handcrafted look.\n3. Durable & Smooth Zippers ? Easy for little hands to open and close securely.\n4.  Soft Shoulder Straps ? Comfortable straps designed to protect young shoulders.\n5. Made for Toddlers ? Best suited for children aged 2?4 years, unisex design.\n6.  Feather-Light Build ? Weighs just 160?170g, making it easy to carry around.\n7.  Perfect for Any Occasion ? Great for preschool, playdates, park visits, or holiday travel.","The Kawaii-Q Football Bear Plush Backpack brings together charm, comfort, and practicality in one adorable package. Designed especially for toddlers aged 2 to 4 years, this soft and lightweight backpack features a sporty bear wearing a football cap?making it a delightful companion for your little one?s daily adventures. With child-friendly materials, easy-to-use zippers, and soft shoulder straps, it?s perfect for preschool, outings, or holidays.",taxable,1,100,350,10,24,26,,,Kids Bags,"Brown Kids Bags, Kids Bags","{""color"":{""name"":""color"",""type"":""color"",""terms"":{""Brown"":{""name"":""Brown"",""color"":""#964B00"",""image"":"""",""show_tooltip"":"""",""tooltip_text"":"""",""tooltip_image"":"""",""image_size"":""""}}}}",color,Brown,1,1,Brown,https://grabaggs.com/product/kawaii-q-football-bear-plush-backpack/,43%
SukiSaku Forest Unicorn Fantasy Kids Backpack - Sky Blue,,,taxable,1,,,,,,899,1699,,,,color,Sky Blue,,1,,,
